<?xml version='1.0' encoding="UTF-8"?>
<!-- $Header: /var/cvsroot/gentoo/xml/htdocs/doc/lt/gentoo-x86-quickinstall.xml,v 1.3 2009/01/31 09:00:48 neysx Exp $ -->

<!DOCTYPE guide SYSTEM "/dtd/guide.dtd">

<guide lang="lt">
<title>„Gentoo Linux“ x86 greitojo diegimo vadovas</title>

<values>
 <key id="raid+lvm">no</key>
 <key id="root">/dev/sda3</key>
</values>

<author title="Autorius">
  <mail link="neysx"/>
</author>
<author title="Autorius">
  <mail link="swift"/>
</author>
<author title="Autorius">Steven Wagner</author>
<author title="Vertėjas">
  <mail link="e.liubarskij@gmail.com">Ernestas Liubarskij</mail>
</author>

<abstract>
Greitojo diegimo vadove glaustai aprašomas „Gentoo“ diegimo procesas. Jo
paskirtis - leisti naudotojams labai greitai atlikti stage3 diegimą. Naudotojai
turėtų jau turėti ankstesnės patirties „Gentoo Linux“ diegime, jei nori sekti
šiuo vadovu.
</abstract>

<!-- The content of this document is licensed under the CC-BY-SA license -->
<!-- See http://creativecommons.org/licenses/by-sa/2.5 -->
<license/>

<version>23</version>
<date>2009-01-09</date>

<chapter>
<title>Įvadas</title>
<section>
<body>

<p>
Šiame vadove yra visos komandos, kurias turėtumėte naudoti stage3 „Gentoo“
diegimo užbaigimui. Stage3 ir „Portage“ momentinių kopijų atsisiuntimui jums
reikės veikiančio internetinio ryšio.
</p>

<p>
Nauji naudotojai turėtų skaityti <uri link="/doc/en/handbook/index.xml">pilną
vadovą</uri>, kadangi jame diegimo procesas apžvelgiamas plačiau.
</p>

<p>
Laikas, per kurį įvykdoma komanda, kurios vykdymui reikia daugiau nei kelių
sekundžių, išvedamas po kiekvienos tokios komandos. Komandų vykdymo laikas
buvo apskaičiuotas AMD 2000 1.66 Ghz kompiuteriu su 512 MB laisvosios kreipties
atmintine (RAM) ir dviem prijungtais prie aparatinio valdiklio SATA diskais.
</p>

<pre caption="Kompiuterio specifikacijos patikrinimas">
<comment>(Ši specifikacija ir laiko apskaitos informacija turėtų padėti jums
nustatyti apytikrį apskaičiavimą laiko, reikiamo diegimo užbaigimui)</comment>

# <i>grep bogo /proc/cpuinfo</i>
bogomips       : 3337.81

# <i>hdparm -tT /dev/sda</i>
/dev/sda:
 Timing cached reads:   1100 MB in  2.00 seconds = 549.97 MB/sec
 Timing buffered disk reads:  224 MB in  3.01 seconds =  74.36 MB/sec

# <i>grep MemTotal /proc/meminfo</i>
MemTotal:       509248 kB
</pre>

</body>
</section>
</chapter>

<chapter>
<title>Greitojo diegimo vadovas</title>

<section>
 <include href="gentoo-x86-quickinstall-media.xml"/>
</section>

<section>
<title>Diskų paruošimas</title>
<body>

<p>
Skaidinių išdėstymo (partition layout) sukūrimui naudokite <c>fdisk</c> arba
<c>cfdisk</c>. Reikės bent jau keitinių (swap) skaidinio (82 tipas) ir vieno
„Linux“ skaidinio (83 tipas). Šiuo scenarijumi sukuriamas <path>/boot</path>,
keitinių ir pagrindinis skaidiniai, kaip naudojama mūsų vadove. Pakeiskite
<path>sda</path> savo disku. Dauguma sistemų ignoruoja įkraunamo (bootable)
skaidinio vėliavėlę, tačiau kai kurioms jo visgi reikia. Nustatykite šią
vėliavėlę savo įkraunamam skaidiniui, naudodami „fdisk“ komandą <c>a</c>.
</p>

<pre caption="Skaidinių sukūrimas">
livecd ~ # <i>fdisk /dev/sda</i>

<comment>(Likusioje vadovo dalyje naudojama ši skaidinių schema)</comment>
livecd ~ # <i>fdisk -l /dev/sda</i>

Disk /dev/sda: 599.9 GB, 599978409984 bytes
255 heads, 63 sectors/track, 72943 cylinders
Units = cylinders of 16065 * 512 = 8225280 bytes

   Device Boot      Start         End      Blocks   Id  System
/dev/sda1  *            1          12       96358+  83  Linux
/dev/sda2              13         110      787185   82  Linux swap / Solaris
/dev/sda3             111       72943   585031072+  83  Linux
</pre>

<p>
Rinkmenų išdėstymo sistemų savo „Linux“ skaidiniuose sukūrimui naudokite
<c>mke2fs</c>, <c>mke2fs -j</c>, <c>mkreiserfs</c>, <c>mkfs.xfs</c> ir
<c>mkfs.jfs</c>. Inicijuokite keitinių skaidinį naudodamiesi <c>mkswap</c> ir
<c>swapon</c>.
</p>

<pre caption="Rinkmenų išdėstymo sistemų sukūrimas ir keitinių aktyvavimas">
<comment>(ext2 yra viskas, ko jums reikia /boot skaidinyje)</comment>
livecd ~ # <i>mke2fs /dev/sda1</i>

<comment>(Pagrindiniame skaidinyje naudokime ext3)</comment>
livecd ~ # <i>mke2fs -j /dev/sda3</i>

<comment>(Keitinių sukūrimas ir aktyvavimas)</comment>
livecd ~ # <i>mkswap /dev/sda2 &amp;&amp; swapon /dev/sda2</i>
</pre>

<p>
Prijunkite naujai sukurtas rinkmenų išdėstymo sistemas prie
<path>/mnt/gentoo</path>. Sukurkite katalogus kitiems jungties taškams
(pavyzdžiui, <path>/mnt/gentoo/boot</path>), jei jums jų reikia ir juos taip
pat prijunkite.
</p>

<pre caption="Rinkmenų išdėstymo sistemų prijungimas">
livecd ~ # <i>mount /dev/sda3 /mnt/gentoo</i>
livecd ~ # <i>mkdir /mnt/gentoo/boot</i>
livecd ~ # <i>mount /dev/sda1 /mnt/gentoo/boot</i>
livecd ~ # <i>cd /mnt/gentoo</i>
</pre>

</body>
</section>

<section>
 <include href="gentoo-x86-quickinstall-stage.xml"/>
</section>

<section>
<title>Branduolio konfigūravimas</title>
<body>

<p>
Įdiekite branduolio pirminį tekstą (paprastai <c>gentoo-sources</c>),
sukonfigūruokite, sukompiliuokite jį ir nukopijuokite
<path>arch/i386/boot/bzImage</path> rinkmeną į <path>/boot</path>.
</p>

<pre caption="Įdiekite branduolio pirminį tekstą, sukompiliuokite jį ir įdiekite branduolį">
livecd etc # <i>time emerge gentoo-sources</i>

real  2m51.435s
user  0m58.220s
sys   0m29.890s
livecd etc # <i>cd /usr/src/linux</i>
livecd linux # <i>make menuconfig</i>
<comment>(Sukonfigūruokite savo branduolį)</comment>
livecd linux # <i>time make -j2</i>

<comment>(Laikas labai priklauso jūsų pažymėtų parinkčių)</comment>
real  3m51.962s
user  3m27.060s
sys   0m24.310s

livecd linux # <i>make modules_install</i>
livecd linux # <i>cp arch/i386/boot/bzImage /boot/kernel</i>
</pre>

</body>
</section>

<section>
 <include href="gentoo-x86-quickinstall-system.xml"/>
</section>

<section id="reboot">
<title>Perkrovimas</title>
<body>

<p>
Išeikite iš pakeisto šakninio katalogo aplinkos, atjunkite visas rinkmenų
išdėstymo sistemas ir perkraukite kompiuterį:
</p>

<pre caption="Perkrovimas">
livecd conf.d # <i>exit</i>
livecd / # <i>umount /mnt/gentoo/proc /mnt/gentoo/boot /mnt/gentoo</i>
livecd / # <i>reboot</i>
<comment>(Nepamirškite išimti CD)</comment>
</pre>

</body>
</section>

<section>
 <include href="gentoo-x86-quickinstall-after-reboot.xml"/>
</section>

</chapter>
</guide>
