<?xml version='1.0' encoding='UTF-8'?>

<!-- $Header: /var/cvsroot/gentoo/xml/htdocs/doc/de/gnome-config.xml,v 1.1 2004/12/24 13:17:51 dertobi123 Exp $ -->

<!-- English CVS Version: 1.1 -->

<!DOCTYPE guide SYSTEM "/dtd/guide.dtd">

<guide link="/doc/de/gnome-config.xml">

<title>Konfigurationsanleitung für Gnome</title>

<author title="Autor">
  <mail link="swift@gentoo.org">Sven Vermeulen</mail>
</author>
<author title="Übersetzer">
  <mail link="rk@oppono.de">Robert Körner</mail>
</author>

<abstract>
GNOME ist eine viel genutzte Arbeitsumgebung. Diese Anleitung versucht, alle
Aspekte GNOME's zu beschreiben - Installation, Konfiguration, Benutzung, ... 
eingeschlossen.
</abstract>

<!-- The content of this document is licensed under the CC-BY-SA license -->
<!-- See http://creativecommons.org/licenses/by-sa/1.0 -->
<license/>

<version>1.1</version>
<date>2004-05-12</date>

<chapter>
<title>Was ist GNOME?</title>
<section>
<title>Das Projekt</title>
<body>

<p>
Das <uri link="http://www.gnome.org">GNOME</uri>-Projekt ist ein freies
Softwareprojekt, engagiert in der Entwicklung von GNOME, einer
Unix/Linux-Desktopsuite und -Entwicklungsplattform. Die <uri
link="http://foundation.gnome.org">GNOME Foundation</uri> koordiniert die
Entwicklung und andere Aspekte des GNOME-Projektes.
</p>

</body>
</section>
<section>
<title>Die Software</title>
<body>

<p>
GNOME ist eine Desktopumgebung und Entwicklungsplattform. Dieses Stück 
freie Software ist von mehreren führenden Firmen der Industrie als <e>die</e>
Desktopumgebung erkoren worden. Es ist sowohl für Business-Benutzer, 
Privatanwender als auch für Entwickler sehr interessant.
</p>

</body>
</section>
<section>
<title>Die Community</title>
<body>

<p>
Wie jedes große Projekt auf der Grundlage freier Software, hat auch GNOME eine
große Basis an Benutzern und Entwicklern. <uri
link="http://www.gnomedesktop.org">Footnotes</uri> beinhaltet GNOME-Desktop News
für Anwender; <uri link="http://planet.gnome.org">GnomePlanet</uri> ist für
Hacker/Mitwirkende und <uri link="http://developer.gnome.org">
Developer.Gnome.Org</uri> ist für GNOME Entwickler.
</p>

</body>
</section>
</chapter>
<chapter>
<title>Installation von GNOME</title>
<section>
<title>Was wird gebraucht?</title>
<body>

<p>
Bevor Sie mit der Installation von GNOME beginnen, sollten Sie evtl. Ihre
USE-Variable editieren. Stellen Sie sicher, dass <c>gtk</c> und <c>gnome</c> in
Ihrer USE-Variable enthalten sind, zu finden in der Datei
<path>/etc/make.conf</path>. Wenn Sie keine KDE-Unterstützung möchten (die
andere große Desktopumgebung), entfernen Sie <c>qt</c> und <c>kde</c> aus Ihrer
USE.
</p>

<pre caption="Beispiel-USE in /etc/make.conf">
USE="-qt -kde gtk gnome"
</pre>

<p>
Wenn Sie damit fertig sind, beginnen Sie die GNOME-Installation, indem Sie 
<c>gnome</c> und <c>xscreensaver</c> kompilieren:
</p>

<pre caption="Installation von GNOME">
# <i>emerge gnome xscreensaver</i>
</pre>

<p>
Dies wird einen Moment dauern. Wärend die Installation fortschreitet, können Sie
all jene Bücher lesen, derer Sie habhaft werden können (es dauert wirklich 
ziemlich lang). Fertig? Wunderbar, jetzt aktualisieren Sie Ihre 
Umgebungsvariablen:
</p>

<pre caption="Aktualisierung der Umgebungsvariablen">
# <i>env-update &amp;&amp; source /etc/profile</i>
</pre>

<p>
Wenn Sie der Ausgabe des vorhergegangenen <c>emerge</c>-Befehls Aufmerksamkeit
geschenkt haben, werden Sie bemerkt haben, dass empfohlen wird, <c>famd</c> zum
Standard-Runlevel hinzuzufügen, damit nautilus und gnome-vfs-monitor 
Dateiänderungen protokollieren können:
</p>

<pre caption="Hinzufügen von famd zum Standard-Runlevel (default)">
# <i>/etc/init.d/famd start</i>
# <i>rc-update add famd default</i>
</pre>

</body>
</section>
<section>
<title>Erste Eindrücke</title>
<body>

<p>
Lassen Sie uns zuerst anschauen, was gerade kompiliert wurde. Verlassen Sie
Ihre Root-Shell und loggen Sie sich als normaler Benutzer ein. Wir werden 
unsere Session so konfigurieren, dass GNOME gestartet wird, wenn wir den 
<c>startx</c>-Befehl ausführen:
</p>

<pre caption="GNOME als Standard-Desktopumgebung">
$ <i>echo "exec gnome-session" &gt; ~/.xinitrc</i>
</pre>

<p>
Starten Sie jetzt Ihre grafische Umgebung durch ausführen von <c>startx</c>:
</p>

<pre caption="Starten von GNOME">
$ <i>startx</i>
</pre>

<p>
Wenn alles glatt läuft, sollten Sie von GNOME begrüßt werden. Herzlichen
Glückwunsch! Jetzt lassen Sie uns jedoch einen Blick auf die Möglichkeiten 
werfen, GNOME Ihren persönlichen Wünschen anzupassen:
</p>

</body>
</section>
</chapter>
<chapter>
<title>Konfiguration von GNOME</title>
<section>
<title>GNOMEs grafischer Login-Manager</title>
<body>

<p>
Wenn Sie den "GNOME Display Manager" (GDM) bei Systemstart automatisch gestartet
haben möchten (so dass Sie sich graphisch einloggen können), müssen Sie das 
<c>xdm</c>-Initscript zum Standard-Runlevel hinzufügen:
</p>

<pre caption="Hinzufügen von xdm zum Standard-Runlevel (default)">
# <i>rc-update add xdm default</i>
</pre>

<p>
Überprüfen Sie jetzt den Inhalt von <path>etc/X11/Sessions</path>:
</p>

<pre caption="Überprüfen von /etc/X11/Sessions">
# <i>ls /etc/X11/Sessions</i>
Xsession Gnome
</pre>

<p>
Wie Sie sehen, ist eine Session (Sitzung) namens <c>gnome</c> vorhanden. Jetzt
editieren Sie <path>/etc/rc.conf</path> und passen zwei Variablen an: 
DISPLAYMANAGER (die auf <c>gdm</c> gesetzt werden sollte) und XSESSION (welche 
auf <c>Gnome</c> gesetzt werden sollte):
</p>

<pre caption="/etc/rc.conf editieren">
DISPLAYMANAGER="gdm"
XSESSION="Gnome"
</pre>

<p>
Wenn Sie jetzt Ihren Rechner neu starten, wird der GNOME Display Manager
Benutzername und Passwort von Ihnen einfordern und als Default-Einstellung
GNOME als Desktopumgebung verwenden (obgleich Sie natürlich auch einen anderen
einstellen können).
</p>

</body>
</section>
</chapter>
</guide>
