<?xml version="1.0" encoding="UTF-8"?>
<!-- $Header: /var/cvsroot/gentoo/xml/htdocs/proj/en/desktop/x/x11/xorg-server-1.9-upgrade-guide.xml,v 1.3 2012/10/28 15:21:02 swift Exp $ -->

<!DOCTYPE guide SYSTEM "/dtd/guide.dtd">

<guide>
<title>Xorg-server 1.9 Upgrade Guide</title>

<author title="Author">
	<mail link="scarabeus"/>
</author>

<author title="Editor">
	<mail link="remi"/>
</author>

<author title="Editor">
	<mail link="chithanh"/>
</author>

<abstract>
This guide shows you how to upgrade X.org server to version 1.9.
</abstract>

<!-- The  content of this document is licensed under the CC-BY-SA license -->
<!-- See http://creativecommons.org/licenses/by-sa/2.5 -->
<license/>

<version>1</version>
<date>2010-09-22</date>

<chapter>
<title>Features changes</title>
<section>
<body>

<ul>
	<li>
		Xorg can detect input devices using udev, removing its HAL support.
		Users who used HAL before need to migrate to udev.
	</li>
</ul>

</body>
</section>
</chapter>

<chapter>
<title>Migrating from xorg-server 1.8</title>
<section>
<body>
<p>
The primary difference is that the deprecated HAL support has now been removed
in favor of udev. If you already used udev before, then no action is necessary.
If you used HAL with <c>xorg-server-1.8</c> then read on.
</p>
</body>
</section>
</chapter>

<chapter>
<title>Migrating from xorg-server 1.7 or 1.8 with HAL</title>
<section>
<body>
<p>
Enabling udev just requires building <c>xorg-server</c> with <c>USE="udev"</c>.
Systems which worked fine with the default HAL fdi will not need special
configuration. If you created custom fdi files, then refer to the <uri
link="xorg-server-1.8-upgrade-guide.xml">Xorg-server 1.8 Upgrade Guide</uri>
how to migrate your configuration to udev.
</p>
</body>
</section>
</chapter>

</guide>
