<?xml version='1.0' encoding='UTF-8'?>
<!-- $Header: /var/cvsroot/gentoo/xml/htdocs/doc/ro/gentoo-security.xml,v 1.7 2012/06/30 18:51:13 swift Exp $ -->

<!DOCTYPE guide SYSTEM "/dtd/guide.dtd">
<guide disclaimer="obsolete" lang="ro" redirect="/doc/en/security/">
<title>Fostul Ghid pentru Securitate în Gentoo Linux</title>
<author title="Autor">
  <mail link="neysx@gentoo.org">Xavier Neys</mail>
</author>
<author title="Translator">
  <mail link="alin@gentoo.org">Alin Dobre</mail>
</author>

<abstract>
Acesta este un ghid pas-cu-pas pentru securizarea Gentoo Linux.
</abstract>

<version>1.0</version>
<date>2005-06-01</date>

<chapter>
<title>Clasat</title>
<section>
<body>

<p>
Acest ghid a fost înlocuit de <uri link="/doc/ro/security/">Manualul pentru
Securitate în Gentoo</uri>.
</p>

</body>
</section>
</chapter>
</guide>
