<?xml version="1.0" encoding="UTF-8"?>
<!DOCTYPE guide SYSTEM "/dtd/guide.dtd">
<!-- $Header: /var/cvsroot/gentoo/xml/htdocs/proj/en/perl/outdated-cpan-packages-perl-experimental.xml,v 1.859 2012/08/15 13:58:30 tove Exp $ -->

<!-- Do Not Translate !! -->
<guide link="/proj/en/perl/outdated-cpan-packages-perl-experimental.xml">
<title>Outdated CPAN Packages (perl-experimental vs CPAN)</title>

<author title="Author">
  Script generated using up2date-ng version 0.24
</author>

<abstract>
  This document lists the packages suspected as outdated
</abstract>

<!-- The content of this document is licensed under the CC-BY-SA license -->
<!-- See http://creativecommons.org/licenses/by-sa/2.5 -->
<license/>

<version>1.0</version>
<date>2012-08-15</date>

<chapter>
<title>Intro</title>
<section>
<body>

<p>
This list is not exhaustive and may contain mistakes/errors. Accuracy is only
guaranteed at 90% and is generated to inform developers about which CPAN
modules are currently out of date in perl-experimental. Our most frequent bug request is
for module bumping. This list is intended as acknowledgement (and hopefully
will curb some of the bugs to boot).
</p>

</body>
</section>
</chapter>

<chapter>
<title>List of outdated packages</title>
<section>
<body>

<table>
  <tr>
    <th>Packagename</th>
    <th>Version in perl-experimental</th>
    <th>Version on CPAN</th>
    <th>Diff</th>
  </tr>
    <tr>
    <ti><uri link="http://metacpan.org/release/Gentoo-Perl-Distmap">Gentoo-Perl-Distmap</uri></ti>
    <ti align="right">0.1.2</ti>
    <ti align="right"><uri link="http://metacpan.org/release/KENTNL/Gentoo-Perl-Distmap-0.1.3/">0.1.3</uri></ti>
    <ti><uri link="http://metacpan.org/diff/release/KENTNL/Gentoo-Perl-Distmap-0.1.2/KENTNL/Gentoo-Perl-Distmap-0.1.3">Diff</uri></ti>
  </tr>
  <tr>
    <ti><uri link="http://metacpan.org/release/Imager">Imager</uri></ti>
    <ti align="right">0.910.0</ti>
    <ti align="right"><uri link="http://metacpan.org/release/TONYC/Imager-0.92/">0.92</uri></ti>
    <ti><uri link="http://metacpan.org/diff/release/TONYC/Imager-0.91/TONYC/Imager-0.92">Diff</uri></ti>
  </tr>
  <tr>
    <ti><uri link="http://metacpan.org/release/Mojolicious">Mojolicious</uri></ti>
    <ti align="right">3.280.0</ti>
    <ti align="right"><uri link="http://metacpan.org/release/SRI/Mojolicious-3.31/">3.31</uri></ti>
    <ti><uri link="http://metacpan.org/diff/release/SRI/Mojolicious-3.28/SRI/Mojolicious-3.31">Diff</uri></ti>
  </tr>
  <tr>
    <ti><uri link="http://metacpan.org/release/POE-Component-Resolver">POE-Component-Resolver</uri></ti>
    <ti align="right">0.920.0</ti>
    <ti align="right"><uri link="http://metacpan.org/release/RCAPUTO/POE-Component-Resolver-0.921/">0.921</uri></ti>
    <ti><uri link="http://metacpan.org/diff/release/RCAPUTO/POE-Component-Resolver-0.920/RCAPUTO/POE-Component-Resolver-0.921">Diff</uri></ti>
  </tr>
</table>

<p>
Total packages suspected as outdated: 4 of 797
</p>

</body>
</section>
</chapter>
</guide>
