<?xml version="1.0" encoding="UTF-8"?>
<!DOCTYPE guide SYSTEM "/dtd/guide.dtd">

<guide lang="it" disclaimer="draft">
<title>Tavolozza dei colori di Gentoo</title>

<author title="Author">
  <mail>sping</mail>
</author>
<author title="Traduzione">
  <mail link="hujuice@inservibile.org">Sergio Vaccaro</mail>
</author>

<abstract>
Informazioni sui colori usati in Gentoo.
</abstract>

<license />


<version>3</version>
<date>2011-06-03</date>


<chapter>
<title>A proposito di questo documento</title>

<section>
<body>

<p>
Questa pagina è stata pensata per facilitare la selezione dei colori alle
persone che si dedicano ai lavori artistici per Gentoo.
</p>

<note>
I colori elencati in questa pagina solo prelevati da <uri
link="/css/main.css">main.css</uri> e <uri link="/xsl/guide.xsl">guide.xsl</uri>
e poi suddivisi in categorie.<br />
Se un colore è stato posto nella categoria sbagliata, contattare il <mail
link="artwork">Gentoo Artwork Team</mail>.
</note>

<impo>
Per favore, non cancellate i colori da questa pagina a meno che non siano stati
eliminati sia da <uri link="/css/main.css">main.css</uri> e sia da <uri
link="/xsl/guide.xsl">guide.xsl</uri>.
</impo>

</body>
</section>
</chapter>


<chapter>
<title>Principali colori Gentoo per il web</title>

<section>
<body>

<table>
<tr>
<ti><fig link="/images/colors/color-45347bff-50x50.png" /></ti>
<ti><fig link="/images/colors/color-7a5adaff-50x50.png" /></ti>
<ti><fig link="/images/colors/color-a0a0f0ff-50x50.png" /></ti>
<ti><fig link="/images/colors/color-dddaecff-50x50.png" /></ti>
<ti><fig link="/images/colors/color-ddddffff-50x50.png" /></ti>
<ti><fig link="/images/colors/color-00ff00ff-50x50.png" /></ti>
<ti><fig link="/images/colors/color-000000ff-50x50.png" /></ti>
<ti><fig link="/images/colors/color-ffffffff-50x50.png" /></ti>
</tr>
<tr>
<th>#45347B</th>
<th>#7A5ADA</th>
<th>#A0A0F0</th>
<th>#DDDAEC</th>
<th>#DDDDFF</th>
<th>#00FF00</th>
<th>#000000</th>
<th>#FFFFFF</th>
</tr>
<tr>
<ti><fig link="/images/colors/color-bbffbbff-50x50.png" /></ti>
<ti><fig link="/images/colors/color-ffffbbff-50x50.png" /></ti>
<ti><fig link="/images/colors/color-ffbbbbff-50x50.png" /></ti>
</tr><tr>
<th>#BBFFBB</th>
<th>#FFFFBB</th>
<th>#FFBBBB</th>
</tr>
</table>

</body>
</section>
</chapter>


<chapter>
<title>Altri colori Gentoo</title>


<section>
<title>Blu</title>
<body>

<table>
<tr>
<ti><fig link="/images/colors/color-0000c8ff-50x50.png" /></ti>
<ti><fig link="/images/colors/color-0000ffff-50x50.png" /></ti>
<ti><fig link="/images/colors/color-4040f0ff-50x50.png" /></ti>
<ti><fig link="/images/colors/color-5a3abaff-50x50.png" /></ti>
<ti><fig link="/images/colors/color-5a3acaff-50x50.png" /></ti>
</tr><tr>
<th>#0000C8</th>
<th>#0000FF</th>
<th>#4040F0</th>
<th>#5A3ABA</th>
<th>#5A3ACA</th>
</tr>
<tr>
<ti><fig link="/images/colors/color-404080ff-50x50.png" /></ti>
<ti><fig link="/images/colors/color-52188cff-50x50.png" /></ti>
<ti><fig link="/images/colors/color-320f61ff-50x50.png" /></ti>
<ti><fig link="/images/colors/color-301060ff-50x50.png" /></ti>
<ti><fig link="/images/colors/color-eeeeffff-50x50.png" /></ti>
</tr><tr>
<th>#404080</th>
<th>#52188C</th>
<th>#320F61</th>
<th>#301060</th>
<th>#EEEEFF</th>
</tr>
</table>

</body>
</section>


<section>
<title>Verdi</title>
<body>

<table>
<tr>
<ti><fig link="/images/colors/color-40ff00ff-50x50.png" /></ti>
<ti><fig link="/images/colors/color-00dd00ff-50x50.png" /></ti>
<ti><fig link="/images/colors/color-0c680cff-50x50.png" /></ti>
<ti><fig link="/images/colors/color-236374ff-50x50.png" /></ti>
<ti><fig link="/images/colors/color-209090ff-50x50.png" /></ti>
</tr><tr>
<th>#40FF00</th>
<th>#00DD00</th>
<th>#0C680C</th>
<th>#236374</th>
<th>#209090</th>
</tr>
</table>

</body>
</section>


<section>
<title>Rossi</title>
<body>

<table>
<tr>
<ti><fig link="/images/colors/color-ff0000ff-50x50.png" /></ti>
<ti><fig link="/images/colors/color-d80000ff-50x50.png" /></ti>
<ti><fig link="/images/colors/color-c02020ff-50x50.png" /></ti>
<ti><fig link="/images/colors/color-982424ff-50x50.png" /></ti>
<ti><fig link="/images/colors/color-a06060ff-50x50.png" /></ti>
</tr><tr>
<th>#FF0000</th>
<th>#D80000</th>
<th>#C02020</th>
<th>#982424</th>
<th>#A06060</th>
</tr>
</table>

</body>
</section>


<section>
<title>Grigi</title>
<body>

<table>
<tr>
<ti><fig link="/images/colors/color-404040ff-50x50.png" /></ti>
<ti><fig link="/images/colors/color-666666ff-50x50.png" /></ti>
<ti><fig link="/images/colors/color-888888ff-50x50.png" /></ti>
<ti><fig link="/images/colors/color-aaaaaaff-50x50.png" /></ti>
<ti><fig link="/images/colors/color-c0c0c0ff-50x50.png" /></ti>
</tr><tr>
<th>#404040</th>
<th>#666666</th>
<th>#888888</th>
<th>#AAAAAA</th>
<th>#C0C0C0</th>
</tr>
</table>

</body>
</section>


<section>
<title>Colori vari</title>
<body>

<table>
<tr>
<ti><fig link="/images/colors/color-5f4e4eff-50x50.png" /></ti>
<ti><fig link="/images/colors/color-a7f3feff-50x50.png" /></ti>
<ti><fig link="/images/colors/color-b89b1cff-50x50.png" /></ti>
<ti><fig link="/images/colors/color-f000f0ff-50x50.png" /></ti>
</tr><tr>
<th>#5F4E4E</th>
<th>#A7F3FE</th>
<th>#B89B1C</th>
<th>#F000F0</th>
</tr>
</table>

</body>
</section>

</chapter>


</guide>
