<?xml version='1.0'?>

<!DOCTYPE news SYSTEM "/dtd/guide.dtd">

<news gentoo="yes" category="linux">

<!-- Enter your name here -->
<poster>Chris Gianelloni</poster>

<!-- Date to be displayed - usually the GWN release date -->
<date>2007-01-15</date>

<!-- Title of the news item - don't forget to change the date -->
<title>Gentoo Weekly Newsletter -- 15 January 2007</title>
<body>

<!-- Alter to your own likings -->
<p>
<b>Gentoo is looking for a new kernel maintainer for the 2.4 branch of
gentoo-sources, the Simplified Chinese translation team is seeking help, and
get information about getting your Gentoo learn on at MIT and more in
this week's <uri link="/news/en/gwn/20070115-newsletter.xml">Gentoo Weekly
Newsletter</uri>.</b> Also in this week's GWN is the usual security, bugs, and
package updates and summaries from the forums and planet.
</p>

</body>
</news>

