<?xml version='1.0'?>

<!DOCTYPE news SYSTEM "/dtd/guide.dtd">

<news gentoo="yes" category="linux">

<!-- Enter your name here -->
<poster>Ulrich Plate</poster>

<!-- Date to be displayed - usually the GWN release date -->
<date>2006-05-01</date>

<!-- Title of the news item - don't forget to change the date -->
<title>Gentoo Weekly Newsletter -- 1 May 2006</title>
<body>

<!-- Alter to your own likings -->
<p>
<b>Gentoo is going to participate as one of the mentoring organisations
in Google's "Summer of Code" event, reports today's <uri link="/news/en/gwn/20060501-newsletter.xml">Gentoo
Weekly Newsletter</uri>. A new piece of documentation now explains how to
create meaningful debugging backtraces, and the qmail herd has started 
incorporating changes suggested by users into their brandnew ebuilds.</b> 
News from the developer mailing list include an explanation for some strange
digest errors, and press clippings, GLSAs and the bugzilla statistics conclude
this week's issue of the GWN. Have fun reading it!
</p>

</body>
</news>

