<?xml version='1.0'?>

<!DOCTYPE news SYSTEM "/dtd/guide.dtd">

<news gentoo="yes" category="linux">

<!-- Enter your name here -->
<poster>Chris Gianelloni</poster>

<!-- Date to be displayed - usually the GWN release date -->
<date>2006-10-02</date>

<!-- Title of the news item - don't forget to change the date -->
<title>Еженедельник Gentoo &mdash; 2 октября 2006</title>
<body>

<!-- Alter to your own likings -->
<p>
<b>В магазине Gentoo появились диски 2006.1. Openoffice.org проводит конкурс
шаблонов и картинок. Рассказ с LinuxParty.dk в Дании. Эти и другие новости
&mdash; в очередном номере 
<uri link="/news/ru/gwn/20061002-newsletter.xml">еженедельника
Gentoo</uri>.</b> Также в номере: советы, как &laquo;обновить мир&raquo;
(update world), не переживая о досадных сбоях пакетов.
</p>

</body>
</news>

