<?xml version="1.0" encoding="UTF-8"?>
<!DOCTYPE guide SYSTEM "/dtd/guide.dtd">
<!-- $Header: /var/cvsroot/gentoo/xml/htdocs/proj/es/desktop/gnome/howtos/gnome-2.12-upgrade.xml,v 1.3 2012/04/26 20:39:54 nimiux Exp $ -->

<guide link="/proj/es/desktop/gnome/howtos/gnome-2.12-upgrade.xml" lang="es">

<title>Guía de actualización a Gnome 2.12</title>

<author title="Autor">
  <mail link="allanonjl@gentoo.org">John N. Laliberte</mail>
</author>
<author title="Traductor">
  <mail link="chiguire@gentoo.org">John Christian Stoddart</mail>
</author>

<abstract>
Esta guía detalla la manera recomendada de actualizar su escritorio
Gnome a la versión 2.12. Asume que Gnome 2.12 todavía aparece como
inestable y ya no aparece en package.mask.
</abstract>

<!-- The content of this document is licensed under the CC-BY-SA license -->
<!-- See http://creativecommons.org/licenses/by-sa/2.5 -->
<license/>

<version>1.2</version>
<date>2005-10-08</date>

<chapter>
<title>¿Qué hay de nuevo? (en lo que respecta Gentoo)?</title>
<section>
<body>

<p>
¿Qué ha cambiado desde la versión 2.12_rc1?
</p>

<ul>
<li>
totem y librsvg usan gecko-sdk con el parámetro USE 'nsplugin'.
</li>
<li>evolution-exchange ya no se incluye en el metapaquete gnome.
</li>
<li>han quitado el parámetro USE firefox de evolution por
problemas con SSL (será agregado de nuevo luego).
</li>
</ul>

<p>
¿Qué ha cambiado desde 2.10.2?
</p>

<ul>
<li>mozilla ya no es un prerequisito para Gnome, ya que epiphany
puede compilar usando firefox</li>
<li>agregado el parámetro USE local 'firefox' para totem</li>
</ul>
</body>
</section>
</chapter>
  
<chapter>
<title>Preparándonos</title>
<section>
<title>Desenmascarando los paquetes</title>
<body>

<p>
Primero, empecemos por agregar los paquetes necesarios a nuestro
archivo <path>package.unmask</path>. Esto no hará falta si ya estamos
corriendo Gentoo inestable.
</p>

<note>
Una lista casi completa de paquetes que deben agregarse se puede
localizar en <uri link="http://dev.gentoo.org/~allanonjl/gnome/2.12.0/package.keywords">package.keywords.
</uri>
</note>
</body>
</section>

<section>
<title>Actualizando Python</title>
<body>

<p>
El siguiente paso es actualizar python a la versión 2.4.
</p>

<pre caption="Actualizando python">
# <i>emerge -av python</i>
# <i>python-updater</i>
</pre>
</body>
</section>

<section>
<title>Algunas otras cosas para revisar</title>
<body>

<warn>
Si ha instalado gnome-doc-utils, vuelva a hacerlo con emerge. (Ahora
debería tener una versión >= a la 0.4.1).
</warn>
</body>
</section>

<section>
<body>
<impo>¿Quiere montar automáticamente los pendrive USB y que todo lo
demás sencillamente funcione? Vea la sección "¿Y ahora qué? más adelante
en esta misma guía.
</impo>
</body>
</section>
</chapter>

<chapter>
<title>Actualizando a 2.12</title>
<section>
<body>

<p>
Esta es la parte divertida :) actualizando a Gnome 2.12.
</p>

<pre caption="Actualizando a Gnome 2.12">
# <i>emerge -av gnome</i>
</pre>

<p>
O, si quiere que no sea tan pesada la descarga:
</p>

<pre caption="Actualizando Gnome 2.12, versión ligera">
# <i>emerge -av gnome-light</i>
</pre>
</body>
</section>
</chapter>

<chapter>
<title>Correr revdep-rebuild</title>
<section>
<body>

<p>
Revise si es necesario ejecutar revdep-rebuild:
</p>

<pre caption="Corriendo revdep-rebuild">
# <i>revdep-rebuild -p</i>
</pre>

<p>
Hará falta ejecutarlo si se listan paquetes. Para correr
revdep-rebuild, hágalo sin el parámetro "-p".
</p>
</body>
</section>
</chapter>

<chapter>
<title>¿Y ahora qué?</title>
<section>
<body>

<p>
Salga de su sesión Gnome actual y ¡re-iníciela!
</p>
</body>
</section>

<section>
<title>¿Desea que los periféricos se monten automáticamente al enchufarlos?</title>
<body>

<p>
Primero, agregue hal y dbus a los parámetros USE, modificando el
<path>/etc/make.conf</path>.
</p>

<p>
Luego, asegúrese de haber desenmascarado hal, dbus, pmount y gamin (si
corre ~x86, ¡esto no es necesario!). Para usar gamin, el núcleo debe
tener activado el inotify.
</p>

<p>
La opción inotify está localizada en "File systems -> Inotify file change notification support".
</p>

<pre caption="Desenmascarando algunas cosas">
# <i>echo "sys-apps/hal" >> /etc/portage/package.keywords</i>
# <i>echo "sys-apps/pmount" >> /etc/portage/package.keywords</i>
# <i>echo "sys-apps/dbus" >> /etc/portage/package.keywords</i>
# <i>echo "sys-fs/cryptsetup-luks" >> /etc/portage/package.keywords</i>
# <i>echo "app-admin/gamin" >> /etc/portage/package.keywords</i>
</pre>

<p>
A lo mejor tiene instalado cryptsetup, que bloquea la instalación
de crypsetup-luks, así que haga:
</p>

<pre caption="Desinstalando cryptsetup">
# <i>emerge unmerge cryptsetup</i>
</pre>

<p>
Si tiene una versión antigua de hal instalada, haga rm -rf
/etc/hal/device.d . De todas formas, el ebuild se lo notificará, pero
hagámoslo ya, de una vez.
</p>

<pre caption="Preparando el emerge del paquete hal">
# <i>rm -rf /etc/hal/device.d/</i>
</pre>

<p>
Asegúrese que no tiene instalado el paquete app-admin/fam. Si es así,
desinstálelo:
</p>

<pre caption="Desinstalando fam">
# <i>rc-update del famd</i>
# <i>emerge unmerge fam</i>
</pre>

<p>
A continuación, la actualización, recompilando todo con los
parámetros USE nuevos, con --newuse. Una forma de hacerlo es con
<c>emerge -uDav --newuse world</c>.
</p>

<pre caption="Actualización con nuevos parámetros USE">
# <i>emerge -uDav --newuse world</i>
</pre>

<p>
Ahora tenemos que iniciar dbus y hal. Estos debe ser iniciados cada que
arranque la máquina.
</p>

<pre caption="Iniciando dbus, hal y gamin">
# <i>rc-update add hald default</i>
# <i>/etc/init.d/hald start</i>
</pre>

<p>
No olvide agregarse a sí mismo al grupo plugdev en
<path>/etc/group</path>.
</p>

<p>
Ahora podrá iniciar el <c>gnome-volume-manager</c> desde la línea de
comando e insertar un pendrive USB, observar cómo se monta
automáticamente y colocar un ícono en el escritorio :)
</p>

<p>
Una manera que gnome-volume-manager ejecute al iniciar la sesión es ir
al Menú de Preferencias -> Sesiones y seleccionar la pestaña de
Programas al Inicio y agregar al <c>gnome-volume-manager</c>. Si desea
cambiar el comportamiento del gnome-volume-manager, inicie
<c>gnome-volume-properties</c> desde la línea de comando.
</p>
</body>
</section>
</chapter>

<chapter>
<title>¿Falló algo al compilar?</title>
<section>
<title>¿Alguien más ha visto algo semejante?</title>
<body>

<p>
Antes que nada, ¿el error se parece a alguno de estos?
</p>

<pre caption="Errores">
make[2]: Entering directory
`/var/tmp/portage/gnome-desktop-2.11.90/work/gnome-desktop-2.11.90/desktop-docs'
 Making all in fdl
 C/fdl.xml:603: parser error : Entity 'copy' not defined
         Copyright copy; YEAR YOUR NAME.
	                         ^
make[3]: Entering directory
`/var/tmp/portage/gnome-desktop-2.11.90/work/gnome-desktop-2.11.90/desktop-docs/fdl'
xsltproc -o fdl-C.omf --stringparam db2omf.basename fdl --stringparam
db2omf.format 'docbook' --stringparam db2omf.dtd "-//OASIS//DTD DocBook XML
V4.1.2//EN" --stringparam db2omf.lang C --stringparam db2omf.omf_dir
"/usr/share/omf" --stringparam db2omf.help_dir "/usr/share/gnome/help"
--stringparam db2omf.omf_in "`pwd`/./fdl.omf.in" `/usr/bin/pkg-config --variable
db2omf gnome-doc-utils` C/fdl.xml
compilation error: file C/fdl.xml line 15 element article
xsltParseStylesheetProcess : document is not a stylesheet
make[3]: *** [fdl-C.omf] Error 5
make[2]: *** [all-recursive] Error 1
make[1]: *** [all-recursive] Error 1
make: *** [all] Error 2
</pre>

<note>Vea <uri>http://bugs.gentoo.org/103322</uri> si este es el problema.
</note>

<note>En pocas palabras, debe re-emerger el paquete gnome-doc-utils
tal como hemos dicho anteriormente.
</note>

<pre caption="Más errores">
Traceback (most recent call last):
  File "/usr/bin/xml2po", line 34, in ?
      import libxml2
      ImportError: No module named libxml2
      make[2]: *** [de/file-roller.xml] Error 1
      make[2]: *** Waiting for unfinished jobs....
      Traceback (most recent call last):
        File "/usr/bin/xml2po", line 34, in ?
	    import libxml2
	    ImportError: No module named libxml2
make[2]: *** [es/file-roller.xml] Error 1
make[2]: Leaving directory
`/var/tmp/portage/file-roller-2.11.92/work/file-roller-2.11.92/help'
make[1]: *** [all-recursive] Error 1
make[1]: Leaving directory
`/var/tmp/portage/file-roller-2.11.92/work/file-roller-2.11.92'
make: *** [all] Error 2
</pre>

<pre caption="Aún más errores">
ACCESS DENIED  unlink:    /usr/share/xml2po/docbook.pyc
ACCESS DENIED  open_wr:   /usr/share/xml2po/docbook.pyc
ACCESS DENIED  unlink:    /usr/share/xml2po/docbook.pyc
ACCESS DENIED  open_wr:   /usr/share/xml2po/docbook.pyc
</pre>

<note>Vea <uri>http://bugs.gentoo.org/104088</uri> si le ocurren
cualquiera de estos errores.
</note>
</body>
</section>

<section>
<title>¿Qué tal si no es uno de los errores antes mencionados?</title>
<body>

<p>
Por favor, revise en <uri>http://bugs.gentoo.org/103197</uri> a ver si
ya se ha reportado un fallo de GNOME 2.12 para el mismo problema:

</p>

<p>
El paso siguiente es buscar el nombre del paquete en bugzilla para
verificar si alguien ya ha publicado un bug. Si después de buscar
durante un par de años (jeje, echando broma) y no encontrar un bug
similar, por favor, ingrese uno (vea a continuación).
</p>

<p>
Si desea saber como ingresar un bug, por favor consulte el documento <uri>http://www.gentoo.org/doc/es/bugzilla-howto.xml</uri>.
</p>

<p>
También estamos a la órden en el canal #gentoo-desktop.
</p>
</body>
</section>
</chapter>
</guide>
