<?xml version='1.0'?>

<!DOCTYPE news SYSTEM "/dtd/guide.dtd">

<news gentoo="yes" category="main">
<poster>swift</poster>
<date>21 October 2004</date>
<title>Gentoo Documentation Project Status Update</title>

<body>

<p>
The <uri link="/proj/en/gdp">Gentoo Documentation Project</uri> has released a
new <uri link="/proj/en/gdp/status/status_20041021.xml">Status Update</uri>.
Most noticeable is an update to the <uri link="/doc/en/handbook">Gentoo
Handbook</uri> which now contains a part on <uri
link="/doc/en/handbook/handbook-x86.xml?part=3">Working with Portage</uri>.
</p>

</body>
</news>
