<?xml version='1.0' encoding="UTF-8"?>
<!-- $Header: /var/cvsroot/gentoo/xml/htdocs/proj/fr/base/x86/gcc-upgrading-guide.xml,v 1.4 2005/12/21 10:39:14 neysx Exp $ -->

<!DOCTYPE guide SYSTEM "/dtd/guide.dtd">

<guide link="gcc-upgrading-guide.xml" disclaimer="obsolete" redirect="/doc/fr/gcc-upgrading.xml" lang="fr">
<title>Mise à jour de GCC pour Gentoo Linux</title>

<author title="Author">
  <mail link="jkt@gentoo.org">Jan Kundrát</mail>
</author>

<abstract>
Ce guide a été remplacé par une autre version.
</abstract>

<!-- The content of this document is licensed under the CC-BY-SA license -->
<!-- See http://creativecommons.org/licenses/by-sa/2.5 -->
<license/>

<version>2.0</version>
<date>2005-12-08</date>

<chapter>
<title>Avertissement</title>
<section>
<body>

<p>
Ce guide a été étendu et remplacé par une <uri
link="/doc/fr/gcc-upgrading.xml">version plus générique</uri>.  Veuillez
consulter la nouvelle version.
</p>

</body>
</section>
</chapter>
</guide>
